{
  "metadata": {
    "generated_at": "2026-01-15T00:08:00-08:00",
    "version": "0.1",
    "source": "manual + parity/system_state_latest.json (2026-01-12)",
    "maintainer": "Jonathan",
    "notes": "Run scripts/collect_system_state.py to refresh hardware details. Update manual fields as services change."
  },
  "units": [
    {
      "id": "wsl2-ubuntu",
      "name": "WSL2 Ubuntu (ai-stack)",
      "role": "primary-dev",
      "status": "active",
      "os": {
        "name": "Ubuntu (WSL2)",
        "version": "WSL2",
        "kernel": "6.6.87.2-microsoft-standard-WSL2"
      },
      "hostnames": ["DESKTOP-JJ1SUHB"],
      "addresses": {
        "lan": ["192.158.1.232"],
        "tailscale": ["100.115.225.100"],
        "local": ["127.0.0.1"]
      },
      "hardware": {
        "cpu": "AMD Ryzen 9 3900X 12-Core Processor",
        "ram_gb": 47.04,
        "gpus": [
          { "name": "NVIDIA GeForce GTX 1080 Ti", "vram_gb": 11, "notes": "Secondary GPU" },
          { "name": "NVIDIA GeForce RTX 3090", "vram_gb": 24, "notes": "Primary Ollama GPU" }
        ]
      },
      "storage": [
        {
          "mount": "/",
          "device": "/dev/sdd",
          "total_gb": 1006.85,
          "free_gb": 714.46,
          "notes": "WSL2 VHDX"
        }
      ],
      "services": ["faithh-backend", "ollama-native"],
      "state_files": [
        "faithh_memory.json",
        "decisions_log.json",
        "project_states.json",
        "scaffolding_state.json",
        "config.yaml",
        ".env",
        "docker-compose.yml"
      ],
      "data_sources": [
        "parity/system_state_latest.json",
        "scripts/collect_system_state.py"
      ],
      "access": {
        "local_path": "/home/jonat/ai-stack",
        "shell": "wsl",
        "notes": "Primary development environment. Docker containers removed in cleanup; Ollama runs native."
      },
      "practices": {
        "start": ["./restart_backend.sh"],
        "stop": ["./stop_backend.sh"],
        "restart": ["./restart_backend.sh"],
        "logs": ["tail -f ~/ai-stack/backend.log"],
        "health_checks": ["curl -s http://localhost:5557/health"]
      },
      "notes": "Ollama is native (systemd). ChromaDB uses Gen8 over Tailscale."
    },
    {
      "id": "gen8-servicebox",
      "name": "Gen8 MicroServer (servicebox)",
      "role": "data-services",
      "status": "active",
      "os": {
        "name": "Ubuntu",
        "version": "unknown",
        "kernel": "unknown"
      },
      "hostnames": ["servicebox"],
      "addresses": {
        "tailscale": ["100.79.85.32"],
        "lan": ["192.158.1.10"]
      },
      "hardware": {
        "cpu": "Intel Xeon E3-1220L V2",
        "ram_gb": 3.8,
        "gpus": []
      },
      "services": ["chromadb-gen8", "pihole", "uptime-kuma"],
      "access": {
        "ssh": "ssh -i ~/.ssh/servicebox_ed25519 jonat@100.79.85.32",
        "notes": "Primary data services. ChromaDB on port 8000. No GPU available."
      },
      "notes": "ChromaDB accessible from FAITHH VM at 192.158.1.10:8000"
    },
    {
      "id": "synology-nas",
      "name": "Synology NAS",
      "role": "storage",
      "status": "active",
      "os": {
        "name": "Synology DSM",
        "version": "unknown"
      },
      "hostnames": ["synology-nas"],
      "services": ["synology-dsm"],
      "notes": "On LAN + Tailscale. Add LAN/Tailscale IPs and model."
    },
    {
      "id": "udm-gen1",
      "name": "UniFi Dream Machine (Gen 1)",
      "role": "network-gateway",
      "status": "active",
      "os": {
        "name": "UniFi OS",
        "version": "unknown"
      },
      "services": ["unifi-network"],
      "notes": "Primary router + UniFi controller. Add LAN IP."
    },
    {
      "id": "unifi-switch-us8",
      "name": "UniFi Switch 8 (US-8)",
      "role": "network-switch",
      "status": "active",
      "os": {
        "name": "UniFi Switch OS",
        "version": "unknown"
      },
      "services": ["unifi-switch"],
      "notes": "Managed switch downstream of UDM. Add LAN IP."
    },
    {
      "id": "windows-host",
      "name": "Windows Host (DESKTOP-JJ1SUHB)",
      "role": "workstation",
      "status": "active",
      "os": {
        "name": "Windows",
        "version": "unknown"
      },
      "hostnames": ["DESKTOP-JJ1SUHB"],
      "notes": "Dev workstation with Windsurf/Cursor. No longer hosts WSL2 or GPUs - moved to Proxmox VM."
    },
    {
      "id": "cloud-services",
      "name": "Cloud Services",
      "role": "external",
      "status": "active",
      "os": {
        "name": "Cloud",
        "version": "n/a"
      },
      "notes": "External dependencies used by FAITHH and tooling."
    }
  ],
  "services": [
    {
      "id": "faithh-backend",
      "name": "FAITHH Backend",
      "unit_id": "wsl2-ubuntu",
      "type": "web",
      "status": "running",
      "ports": [5557],
      "endpoints": [
        { "method": "GET", "path": "/health", "url": "http://localhost:5557/health", "purpose": "health" },
        { "method": "POST", "path": "/api/chat", "url": "http://localhost:5557/api/chat", "purpose": "chat" },
        { "method": "GET", "path": "/api/status", "url": "http://localhost:5557/api/status", "purpose": "status" },
        { "method": "GET", "path": "/api/compass", "url": "http://localhost:5557/api/compass", "purpose": "compass dashboard" },
        { "method": "POST", "path": "/api/compass/log", "url": "http://localhost:5557/api/compass/log", "purpose": "compass work log" },
        { "method": "GET", "path": "/api/pulse/status", "url": "http://localhost:5557/api/pulse/status", "purpose": "pulse status" },
        { "method": "GET", "path": "/api/pulse/chips", "url": "http://localhost:5557/api/pulse/chips", "purpose": "pulse chips" },
        { "method": "GET", "path": "/api/pulse/proposals", "url": "http://localhost:5557/api/pulse/proposals", "purpose": "pulse proposals" },
        { "method": "POST", "path": "/api/pulse/approve", "url": "http://localhost:5557/api/pulse/approve", "purpose": "approve chip proposal" },
        { "method": "POST", "path": "/api/pulse/reject", "url": "http://localhost:5557/api/pulse/reject", "purpose": "reject chip proposal" }
      ],
      "dependencies": ["ollama-native", "chromadb-gen8"],
      "notes": "faithh_professional_backend_fixed.py"
    },
    {
      "id": "ollama-native",
      "name": "Ollama (native)",
      "unit_id": "wsl2-ubuntu",
      "type": "llm",
      "status": "running",
      "ports": [11434],
      "endpoints": [
        { "method": "GET", "path": "/api/tags", "url": "http://localhost:11434/api/tags", "purpose": "model list" }
      ],
      "notes": "CUDA_VISIBLE_DEVICES=1,0"
    },
    {
      "id": "chromadb-gen8",
      "name": "ChromaDB (Gen8)",
      "unit_id": "gen8-servicebox",
      "type": "vector-db",
      "status": "running",
      "ports": [8000],
      "endpoints": [
        { "method": "GET", "path": "/api/v2/heartbeat", "url": "http://192.158.1.243:8000/api/v2/heartbeat", "purpose": "health" }
      ],
      "notes": "Primary knowledge base"
    },
    {
      "id": "pihole",
      "name": "Pi-hole",
      "unit_id": "gen8-servicebox",
      "type": "dns",
      "status": "running",
      "ports": [53, 80],
      "endpoints": [
        { "method": "GET", "path": "/admin", "url": "http://100.79.85.32/admin", "purpose": "dashboard" }
      ]
    },
    {
      "id": "uptime-kuma",
      "name": "Uptime Kuma",
      "unit_id": "gen8-servicebox",
      "type": "monitoring",
      "status": "running",
      "ports": [3001],
      "endpoints": [
        { "method": "GET", "path": "/", "url": "http://100.79.85.32:3001", "purpose": "dashboard" }
      ]
    },
    {
      "id": "synology-dsm",
      "name": "Synology DSM",
      "unit_id": "synology-nas",
      "type": "storage",
      "status": "active",
      "notes": "Add DSM URL + SMB/NFS ports."
    },
    {
      "id": "unifi-network",
      "name": "UniFi Network Controller",
      "unit_id": "udm-gen1",
      "type": "network-controller",
      "status": "active",
      "notes": "Runs on UDM Gen 1. Add controller URL."
    },
    {
      "id": "unifi-switch",
      "name": "UniFi Switch (US-8)",
      "unit_id": "unifi-switch-us8",
      "type": "switch",
      "status": "active",
      "notes": "Managed by UniFi Network Controller."
    },
    {
      "id": "groq-api",
      "name": "Groq API",
      "unit_id": "cloud-services",
      "type": "api",
      "status": "configured",
      "notes": "External LLM provider"
    },
    {
      "id": "claude",
      "name": "Claude.ai",
      "unit_id": "cloud-services",
      "type": "api",
      "status": "configured",
      "notes": "External assistant"
    }
  ],
  "connections": [
    {
      "from_unit": "faithh-vm",
      "to_unit": "gen8-servicebox",
      "type": "lan",
      "ports": [8000],
      "description": "FAITHH VM uses Gen8 ChromaDB over LAN (192.158.1.10:8000)"
    },
    {
      "from_unit": "faithh-vm",
      "to_unit": "cloud-services",
      "type": "https",
      "ports": [443],
      "description": "LLM API calls (Groq primary, Anthropic/Gemini fallback)"
    },
    {
      "from_unit": "windows-host",
      "to_unit": "faithh-vm",
      "type": "ssh",
      "description": "Windows dev workstation connects to FAITHH VM via SSH"
    },
    {
      "from_unit": "udm-gen1",
      "to_unit": "unifi-switch-us8",
      "type": "lan",
      "description": "UDM manages the US-8 switch"
    },
    {
      "from_unit": "udm-gen1",
      "to_unit": "gen8-servicebox",
      "type": "lan",
      "description": "Gen8 servicebox connected on LAN behind UDM"
    },
    {
      "from_unit": "udm-gen1",
      "to_unit": "synology-nas",
      "type": "lan",
      "description": "NAS is connected on the LAN behind the UDM"
    }
  ]
}
